{
  "schemaVersion": "0.1.0",
  "kind": "capability",
  "id": "editor.geck",
  "title": "GECK editor",
  "satisfiedBy": [
    {
      "id": "provider.editor.geck",
      "providerType": "editor"
    }
  ],
  "requires": {
    "capabilities": [
      {
        "id": "game.falloutnv"
      }
    ]
  },
  "scope": "editor-root",
  "stability": "stable",
  "features": [
    "quest-authoring",
    "dialogue-authoring",
    "cell-editing"
  ]
}
